"title","description"
"treat your dog to doughnut-shaped biscuits from krispy kreme this weekend","in honor of national dog day, krispy kreme is selling dog treats shaped like their classic doughnuts."
"tortellini salad","this easy garden tortellini salad with is the perfect bbq side dish made with three-cheese cheese tortellini pasta, summer tomatoes, broccoli florets, and black olives. tortellini salad i love a chilled tortellini salad in the summer. it’s a simple side dish …"
"7 day healthy meal plan (aug 22-28)","a free 7-day, flexible weight loss meal plan including breakfast, lunch and dinner ideas and a shopping list. all recipes include macros and links to ww recipe builder to get your personal points. 7 day healthy meal plan i’m trying to hang on to every drop le…"
"7 day healthy meal plan (aug 15-21)","a free 7-day, flexible weight loss meal plan including breakfast, lunch and dinner ideas and a shopping list. all recipes include macros and links to ww recipe builder to get your personal points. 7 day healthy meal plan while most of us are still lucky enoug…"
"attention hotties: megan thee stallion is dropping her next album, traumazine, tomorrow","megan thee stallion started teasing her next album a mere few days ago, and now the rapper has revealed the album, titled traumazine, will drop tonight at midnight. surprise!!!read more..."
"if you'd rather be titillated than terrified, rsvp yes to the invitation","the invitation opens with a classic scenario: lightning illuminating a gothic mansion as thunderclaps roar. a gaunt woman, lit by candlelight, prepares to launch herself from the second floor banister. the shadows seem to be whispering. there’s something eeri…"
"five things to do with corn, tomatoes, or both","when i was a kid, the only thing preventing complete despair over the end of summer vacation was that it happened to coincide with peak corn and tomato season.… read more 
the post five things to do with corn, tomatoes, or both appeared first on cup of jo."
"a shrub for summer nights","today, i’d like to introduce you to my favorite non-alcoholic drink: the fruity, tangy, vibrant shrub. shrubs are drinking vinegars, and though there are lots of great ones on the market right now — upmountain and weathertop are recent wins — the most satisfy…"
"see a starry 'crown' dazzle in both the northern and southern skies","several northern constellations have southern counterparts. learn the stories behind constellations corona borealis and corona australis and the stars within them."
"amtrak's new menu items, ranked","one reporter. two trains. fifteen of amtrak’s breakfast, snack, sandwich and salad offerings on its new menu."
"the 101 best insults from 'game of thrones,' ranked","the insults in hbo's ""game of thrones"" are endless. we recount the 101 best insults along with commentary and video clips from the show, which now continues with ""house of the dragon."""
"megan thee stallion’s ‘traumazine’ is a multi-faceted mood","on her second album, the rap superstar comes up with just the right balance of slick bops and searing confessionals."
"rs recommends: the best teeth whitening kits on the market right now","professional whitening can be expensive — here's where a good at-home whitening kit comes in"
"thirteen things we absolutely do not know about taylor swift’s ‘midnights’","her new album is the biggest mystery in the music world right now. here are the lingering questions that will keep us up until it finally comes out in october."
"sip your way through fall at these us wine harvest festivals","some people look forward to autumn for the multi-colored foliage, hayrides, apple picking and cider samplings. others anticipate a different kind of fall fruit picking: the great grape harvests that transform humble fruit into the prized wines we get to enjoy…"
"11 most underrated destinations in france","vacations in france often mean a weekend jaunt to paris or a glamorous sunshine holiday in cannes. however, there’s so much more to the country than the eiffel tower and the french riviera. since france lifted all covid-19 restrictions for international trave…"
"best coastal hotels to visit during your next seaside getaway","the moment the audience saw diane keaton’s kitchen in the iconic film “something’s gotta give,” an aesthetic was born. the earth tones, the double islands in the kitchen and the beachfront property location made this space practically the third star of the fi…"
"3rd time’s the charm: finally taking a canadian dream trip to banff, lake louise and jasper","like many travelers, we had epic plans for the summer of 2020. we had mapped out a highly anticipated multigenerational family trip to canada with my parents and kids for june 2020. it was a big trip that would let us tick off several bucket-list destinations…"
"the best hawaii cruises for every type of traveler","cruising the hawaiian islands offers u.s. travelers an immersive south pacific escape with all the comforts of home. in fact, our 50th state is in many ways an ideal cruise destination. it has year-round sunny weather, four main islands featuring varied topog…"
"upscale stay, but missing amenities: my time at the foundry hotel in asheville","some of the most interesting hotels i’ve stayed in are innovative updates of existing structures that had previous lives. there was the imposing hotel katajanokka in helsinki — which once served as the city’s main prison — and the murray in hong kong — one of…"
"19 disney world secrets that can add ‘pixie dust’ to your vacation","sometimes, it can feel like you need to know some sort of secret handshake to maximize a visit to disney world. you have to purchase a ticket and make a theme park reservation, you have to navigate the disney app to skip the lines with genie+ or join the virt…"
"an entertaining jersey shore getaway in a former salvation army: an eclectic stay at the asbury hotel","as a born and raised jersey girl, i have a long history with asbury park. i’ve visited the beach town made famous by bruce springsteen since i was a child intent on taking a spin on the indoor carousel (now defunct). i came back as a teen for the rock scene a…"
"a nearly perfect desert oasis: the six senses shaharut in israel","the sun had just gone down in the negev desert as i began to write this story about a stunning couple of days at six senses shaharut in southern israel. a strong breeze on my room’s terrace cut through the heat of the day, providing a relaxing backdrop to my …"
"‘little demon’ review: danny devito’s devil is just another ‘bad’ dad","with lucy and danny devito as the antichrist and satan, the fxx series is a family affair to its core — and familiar to a fault."
"jeff baena wanted ‘spin me round’ to be giallo version of ‘under the tuscan sun’ with #metoo twist","the filmmaker tells indiewire about crafting the ultimate confrontation of expectation versus reality in the alison brie and aubrey plaza two-hander."
"a new night city wire will show what’s next for cyberpunk 2077 next week","not done with night city quite yet
there's more news to share about cyberpunk 2077. cd projekt red is airing a new night city wire, its cyberpunk 2077 update stream, on september 6.
the new night city wire will air on cd projekt red's twitch channel on septem…"
"how west african cuisines originated and developed over centuries","as the popularity of african dishes rises around the world, most of the conversation has focused on their appearance, spiciness, and recipes, more intensely on ownership and appropriation, but barely on how they came about.read more..."
"papers: carrasco a man utd target | chelsea optimistic over auba deal","all the top stories and transfer rumours from friday's national newspapers..."
"video: there's finally (peer reviewed) chemistry in wine and food pairings","red wine goes with meat; white wine goes with fish. port goes with stilton. never drink wine after eating artichokes. these rules about how to pair wine with food have solid chemical underpinnings—but many others don't."
"easy lamb shanks (instant pot, crockpot, or oven)","these fork-tender lamb shanks make for an impressive and hearty supper that can be cooked with a minimum of fuss. plus, this dish is gluten-free, paleo, keto, and whole30 compatible! on blustery nights when my teeth are chattering, there are few things that m…"
"west's most important water supply drying up. soon, life for 40 million will change...","west's most important water supply drying up. soon, life for 40 million will change...

 
 
 
 (third column, 7th story, link)

 

 

 
 related stories:usa endures amid summer for record books...
nyc carriage horse collapses on hot street...
wildfire i…"
"dairy-free caesar dressing (whole30, keto)","this astoundingly easy dairy-free whole30 caesar dressing tastes just like the original: creamy, tangy, garlicky, and bursting with umami! make some, and i guarantee you’ll want to spoon it on everything! are you on a whole30, but missing a crisp and deliciou…"
"switcharcade round-up: reviews featuring ‘ooblets’ and ‘aquadine’, plus the latest releases and sales","hello gentle readers, and welcome to the switcharcade round-up for september 5th, 2022. in today’s article, we’ve got an assortment … continue reading ""switcharcade round-up: reviews featuring ‘ooblets’ and ‘aquadine’, plus the latest releases and sales"""
"how to find small-cap investing opportunities","you have to be willing to put in the work."
"mediterranean pasta salad","this mediterranean pasta salad recipe is bursting with fresh flavor! mix up a batch as an easy side dish or…
a couple cooks - recipes worth repeating."
"how to make a shrub drink","a shrub drink is a simple, refreshing beverage made with vinegar and fruit! drink it as a cocktail or mocktail. …
a couple cooks - recipes worth repeating."
"film festival heat brightens arthouse outlook; ‘honk for jesus’, ‘gigi & nate’, françois ozon’s ‘peter von kant’ make holiday weekend debut – specialty preview","film premiere and headlines spilling from a trio of fests in full swing (venice), just starting (telluride) and queued up (toronto) have indie exhibitors and distributors the most hopeful since covid hit that a stream of new films could fire up the arthouse m…"
"why bread and wine? enjoying the meal above all meals","on the night he was betrayed, our lord jesus wanted to give his people a sign of his covenant love. as god had once assured noah with a rainbow, and lifted abraham’s eyes to the stars, and sanctified the sabbath for israel, so now jesus wanted to give his dis…"
"garlic butter zucchini boat bolognese.","this zucchini boat bolognese is an excellent weeknight meal! it’s super delicious: the zucchini is brushed with garlic butter, filled with bolognese and topped with cheese, then baked until melty and warm and golden. delish! it’s zucchini boat season! okay te…"
"pesto risotto stuffed peppers.","we are in love with these pesto risotto stuffed peppers! creamy, parmesan risotto laced with classic basil pesto, stuffed in sweet bell peppers and roasted until perfect. cozy, comforting summer food! these stuffed summer peppers are cheesy and herby and ever…"
"easy pesto melt chicken.","this pesto melt chicken is a super simple weeknight meal! marinated chicken, seared until golden then topped with pesto and baked with mozzarella cheese. so delicious and easy! super easy late-summer dinner is here! if you have some basil or pesto to use up a…"
"looking back at 25 years of black hat","the black hat usa conference's silver jubilee is an opportunity to remember its defining moments, the impact it has made on the security community, and its legacy."
"monterey car week 2022 auction preview","monterey car week is upon us once more, and the auction cluster that provides a large part of the show at the week-long automotive celebration is shaping as the biggest in history.continue readingcategory: automotive, transporttags: ferrari, bentley, mclaren,…"
"free 3d models: 25 quality assets for your cg projects","these brilliant free 3d models will save you time on your next design project."
"chickpea veggie wraps with chimichurri vinaigrette","one of the best meals i had on vacation recently was from a food truck in hanalei, on kauai.  normally i wouldn’t opt for a meatless veggie wrap, but with a little sign that said their beef was sold out for the day, i decided to try it, since i had already st…"
"a grubhub guide to the east village: 5 new restaurants you should have on your radar","when it comes to the best nyc neighborhoods for food, it’s hard to beat the east village. this culinary mecca has it all—slurp-worthy ramen, experimental tasting menus, bohemian cafes, and bottomless brunches. [ more › ]"
"creative arts emmys day 1 winners list – updating live","the big nights before tv’s biggest night are here. tonight is the first of the two 2022 creative arts emmy ceremonies, with the second set for sunday, and deadline is updating the winners live as they’re announced at the microsoft theater in los angeles. how …"
"liger promotions: when vijay deverakonda enjoyed the ‘great gujarati thali’","in total, the scrumptious thali comprised over 21 dishes among other things."
"‘barbarian’ is a relentlessly terrifying horror feat that will keep you guessing","there's one thing you can be sure of when watching this new horror movie: you have no idea what comes next. aurora amidon reviews barbarian."
"how a self-trained italian blacksmith built himself an amusement park","when, in 1968, bruno ferrin first set foot in the poplar forest on a hill near treviso, italy, he knew he had found a good spot. “i was looking for a way to work in my spare time,” he says. “and thought i could open a casual food stand in the woods.” fifty-th…"
"eat like an apollo 11 astronaut with this celestial dessert","on the evening of august 13, 1969, cars halted in front of the century plaza hotel in los angeles began dispelling their 1,440 occupants: mega-stars of the hollywood golden age, diplomats from dozens of countries, former and future american presidents, and so…"
"10 habits that are making you look older","these 10 habits age your skin, so avoid them if you want to look younger longer. consider this our guide on how to look younger."
"how to clean your outdoor furniture and soft furnishings (9 photos)","many people give their outdoor furniture, pillows, pads and rugs a good cleaning in spring, but late summer and early fall also are opportune times for sprucing things up. they’ll have a sparkle that you can enjoy the rest of the season. and if the end of spe…"
"links 9/3/2022","our keen daily links, including floods in pakistan, freezing brits, tech sanctions on china, price caps on russia, cyber attacks, cyber surveillance, and artillery shells with messages from gamers."
"2:00pm water cooler 9/9/2022","by lambert strether of corrente this is naked capitalism fundraising week. 581 donors have already invested in our efforts to combat corruption and predatory conduct, particularly in the financial realm. please join us and participate via our donation page, w…"
"2:00pm water cooler 8/24/2022","~ today's water cooler ~"
"2:00pm water cooler 8/11/2022","~ today's water cooler ~"
"12 airbnbs with pools to soak up every last drop of summer left","airbnbs with pools aren't a superfluous vacation option, but a potentially necessary one for your next mental health break before q4. here, our top picks."
"ian mcewan on ageing, legacy and the attack on his friend salman rushdie: ‘it’s beyond the edge of human cruelty’","the author’s new novel explores how global events shape individual lives – but nothing prepared him for this ‘dark moment’• got a question for ian mcewan?ian mcewan was on holiday on the remote coast of north-west scotland when he heard the news that his grea…"
"how an indigenous australian artist ‘astonished’ a giant of american art","sol lewitt never met emily kame kngwarreye, who began painting in her 80s, but he was blown away by her work. a new agnsw show celebrates their unlikely link<ul><li>get our weekend culture and lifestyle email</li></ul>he was one of the 20th century’s pioneers…"
"cooking with nora ephron","“the food in the novel reflected a transitional time in american cuisine, when cooking from cans was still respectable but the from-scratch movement was in its embryonic stages.”"
"wines of the week: simon family estate cab, champagne laurent-perrier, rémy martin cognac, and cedar ridge bourbon","when it comes to pairing hamburgers with wine, i hit some sort of highlight not too long ago with my red wine of the week from the new, limited-production napa valley producer simon family estate"
"in colorado, wine country comes spiked with adventure","the last stretch of a four-hour drive from denver meanders through earthy red rock canyon walls to the western slope, where you’ll find peach stands and wineries, but also a new riverfront park, epic mountain biking and scenic hikes."
"red wines for a budget tasting: classic regions, with a twist","2017 quinta do crasto, douro, portugal blend of tinta roriz (30%), touriga franca (25%), touriga nacional (35%) and tinta barroca (10%) 2017 strehn blaufrankish, burgenland, austria weingut strehn, located in deutschkreutz in mittelburgenland (also called the…"
"little known italian wines and wine zones that deserve your attention","as the italian wine industry is largely defined by indigenous varietals, the country’s most important wines are all about distinctiveness."
"italian wine gems that should be better known","as wine is produced in all twenty regions of italy, and there are thousands of producers growing hundreds of varietals, it’s no wonder that there are so many italian wines that are relatively unknown."
"wynns john riddoch: top cabernet sauvignon from the famous red soil of coonawarra in australia","australia may be famous for some big reds but go to the cool region of coonawarra and balance is the key word. john riddoch cabernet sauvignon 2019 from pioneer winery wynns will be released at la place de bordeaux in september, one of the few non-bordeaux wi…"
"‘house of the dragon’ wines are here for the ‘game of thrones’ prequel’s august 21 premiere","“house of the dragon,” the prequel to “game of thrones,” is coming to hbo and hbo max on august 21. the accompanying wines are available now."
"greenest wine region in europe and its white wine, a favorite among sommeliers","an italian wine region, nicknamed ""the greenest region in europe"", proudly preserves those things that have been lost in other parts of the world."
"two affordable spanish wine styles to satisfy weeknight cravings","both of these are probably new to many people but have centuries of winegrowing heritage, which makes them all the more interesting for discovery. and glancing at prices for these bottles online, there are affordable options around."
"the “tuscan vine germplasm”: activating the ancestor vision at avignonesi","wine made from grapes you've probably never heard of, and an owner who speaks of ""tuscan vine germplasm."" that's avignonesi, and their ancestor vision that is ultra current."
"how to host a group wine tasting for ten dollars per person","wine tastings with a group are fun and engaging experiences. tastings organized on a budget, however, present their own set of challenges. here are three guiding principles to get yours right."
"discover drinks made with local cherries in door county, wisconsin","door county cherries make their festive appearance around the peninsula in the form of wine, cider, and beer, and cocktails."
"in rome’s recalescent summer, lessons on lazio’s wines","“we’re presenting a new lazio today,” say carla and francesco trimani during a regional line-up at the family’s wine bar on a day especially representative of these hot dry months in the capital city. in rome, the historic trimani wine merchant family has alw…"
"how mela wine was born out of this best friend group’s book club","we’ve all heard the jokes about book clubs and wine: there’s usually a lot of the latter, and sometimes the beverage overshadows the books. that’s what happened with this book club, but on a whole other level."
"tenuta garetto - first-rate examples of barbera for every occasion","one of the vintners who has embraced barbera d’asti in its various forms is stefano gagliardo."
"famous super tuscan wine producer brings tuscany to new york city while displaying age-worthy quality through verticals","a magical afternoon in downtown manhattan that was hosted by super tuscan wine producer ornellaia bringing tuscany to new york city."
"for napa’s newest cult cab — art is part of the terroir","suzanne deal booth is not your ordinary art collector, and her new wine project, bella oaks cabernet sauvignon, is not your typical napa cab."
"how to taste white wines on a budget: bottle recommendations, and the stories to tell","the story is the ace up your sleeve when hosting a tasting of white wines on a budget. the story won't compensate for ""bad wine,"" but it will add to the flavor of the experience. here are three recommended bottles."
"italy’s trasimeno rosato enjoys new attention","for those interested in unique and approachable italian wines, rosato from trasimeno is an appealing option."
"3 places to eat and drink in golden, colorado","golden, colorado is a historic mountain town full of wild wild west charm. it’s home to tons of outdoor adventure; coors brewery, the largest single sit brewery in the world; and right down the road is the famous red rocks park & amphitheater. here’s where to…"
"the untold story of helen bacigalupi’s wild drive over the mountain to deliver sonoma chardonnay to chateau montelena","what is less well known is the story of helen bacigalupi, who sold 14 tons of her sonoma chardonnay grapes to winemaker, mike grgich, who used them to craft part of the legendary 1973 chateau montelena chardonnay that won first place white wine in the judgmen…"
"remarkable sauvignon blanc from california","thankfully, there are dozens of producers in the golden state that do take sauvignon blanc seriously and craft excellent wines; then there are a precious few that aim to make wines from this grape that can rank with some of the best examples from around the w…"
"fitou in the south of france revives its image with local grape carignan","the fitou wines from languedoc often have a high percentage of carignan, an exciting grape variety that is seeing a renaissance in popularity and is now loved by many. it is often blended with grenache and syrah to make some delicious wines in fitou in the so…"
"windstar cruises launches new ways to see the red sea and the persian gulf","sometimes even including a suez canal transit, these new windstar cruises will bring a maximum of 312 guests to ports in the red sea and persian gulf."
"wines of the week: beach juice rosé, j. lohr pure paso, and slane special edition irish whiskey","yet for all of the ways that americans mark the traditional end of summer, there’s one aspect of the next three days that most of us can agree on: drinking well."
"bodegas toro albalá in montilla-moriles: memorable wines in warm and sunny andalucía","for some of spain’s most memorable and extraordinary wines, taste pedro ximénes from montilla-moriles. bodegas toro albalá leads the way."
"austria’s eruption winemakers ‘generate energy’ in steiermark","a group of nine winemakers in austria’s vulkanland steiermark have organized themselves for the future, based on ancient soil and modern skills."
"stellar cabernet sauvignon from napa valley - new releases","2018 was a classic in napa valley, but peter heitz, winemaker at turnbull winery in oakville, believes 2019 is the finest vintage in napa since 2007, with the possible exception of 2013."
"the man behind the italian cuisine you don’t know about but should","andrea ballerini, one of the italian riviera’s most dynamic restaurateurs, features tabarchine cuisine, a unique cooking style that blends ligurian, tunisian and sardinian flavors, in addition to old-time genoa favorites, at his restaurants and classes in ses…"
"trapiche brought modern tech and sustainability to argentina’s vineyards","argentina's trapiche winery has kept at the forefront of the industry while both innovating keeping prices moderate."
"10 of the world’s coolest boating experiences for travelers","from seeing glow worms light up sea caves in new zealand to floating in a hot tub on the hudson river, these boating experiences should be on every traveler's bucket list."
"chef matthew dolan opens san francisco’s 25 lusk with reimagined dining concept","earlier this month, 25 lusk opened with a reimagined concept that replaced their old prix-fixe menus in favor of shareable, tapas-style dishes and a dining experience that remains polished with an added accessibility for all. here's everything you should know…"
"new reasons why connecticut’s mayflower inn & spa is the ideal weekend getaway","mayflower inn & spa, auberge resorts collection, was already a popular, bucolic retreat in connecticut's litchfield hills two hours from new york. but an exciting new chef and menus have created even more reason to go."
"james new york nomad: a historic hotel that’s timeless","located on the corner of madison avenue and east 29th street in manhattan, the james new york nomad hotel has a storied and intriguing past."
