"title","description"
"55 of the best gifts for men who have everything: the one-stop-shop for every man on your list (2022 edition)","men are notoriously hard to shop for and even more challenging if they seem to have everything under the sun. if you’re looking for the best gifts for men who have everything, you’re not alone.  this guide has something for..."
"house of the dragon recap: a bloody boar and one very cooked crab","daemon gets a little crabby at the end of this week’s house of the dragon, and his impetuous burst of violence turns out being good news for the conflict in the stepstones (but spectacularly bad news for the crab feeder, his men and one very unfortunate messe…"
"cowboy caviar","cowboy caviar, sometimes called texas caviar, is a simple dip that is always a crowd pleaser. it is fresh, colorful, and so delicious! it is similar to my black bean salad, but is made with black-eyed peas and has a vinaigrette-style dressing that gives the c…"
"greek chickpea salad","chickpea salads are my favorite salads. a few of my go-to’s include: easy chickpea salad, chickpea, avocado, & feta salad, fall chickpea salad, and roasted cauliflower chickpea salad. i also really love this greek chickpea salad because greek flavors are alwa…"
"open post: hosted by jc chasez’s silver fox tiktok debut","jc chasez arguably had the most vocal talent of all of the members of nsync; to me, those velvety pipes always outshined justin timberlake’s high-pitched warblin’. and back in nsync’s prime, justin was also known for his bleached “ramen noodle” looking hair. …"
"will charles iii be the first eco-king? vocal proponent of green energy and battler of big carbon takes the throne","ann arbor (informed comment) - the new king of england, despite being a booster of green energy and a foe of the climate emergency is not in a position to set government policy on climate issues. unfortunately, that is the prerogative of new prime minister li…"
"the last, lonely days of ivana trump","her friends wish she’d never met the rakish young italian they called the “snake.”"
"links + small things","well! how did this short week feel for you? it went by extremely fast for me! all of my kids are in the school rhythm now, so i feel like we have officially started a new season. i like the routine and predictability of the school year, and it certainly makes…"
"a ph-responsive crosslinker platform for antibody-drug conjugate (adc) targeting delivery","chem. commun., 2022, advance articledoi: 10.1039/d2cc03052g, communication open access &nbsp this article is licensed under a creative commons attribution 3.0 unported licence.francesca migliorini, elena cini, elena dreassi, federica finetti, giovanni ievoli,…"
"how chef mario carbone built the most celebrity-studded restaurant on earth","from leonardo dicaprio, rihanna, and jay-z to kim kardashian, barack obama, and secretive millionaires, it’s as if the rich and powerful simply are not aware that other places exist to get dinner. and it’s all thanks to this man."
"the women whose boyfriends are made out of plastic","since their inception, sex dolls have been targeted toward men. but as an increasing number of women are sharing peaceful, intimacy-filled lives with their male equivalents, it’s clear there’s a gap in the market"
"hatch chile: the green chile dreams are made of","everything you ever wanted to know about hatch chile: how to cook, roast, and enjoy the most celebrated green chile of all time!"
"what it’s really like inside a blindfolded dinner","“the customer is really surrendering to the chef — it’s a lot of trust.”"
"dispatch: we spent a night at the audemars piguet hotel (which is not really called that)","technically, people, it's called the hôtel de horlogers. either way, feel free to scatter my ashes here when i am gone."
"7 sonoma wine tasting rooms that are the perfect introduction to the region","sonoma tasting rooms are the best place for newcomers to try california wine. here are the best places to schedule a tasting."
"10 of the most stylish boutique hotels in santa barbara","stylish and unique, santa barbara boutique hotels offer a personalized stay. hotels with pools, balconies, and world-class hotel restaurants."
